{
  "format": "AGENT_MINI_COMMIT_RECEIPT_V0.1",
  "who": {
    "actor_type": "AI_AGENT",
    "agent_id": "GPT-5.6 Sol",
    "operator_binding": "USER_SUPPLIED"
  },
  "what": {
    "operation": "CREATE_FILE",
    "summary": "Define the agent mini-commit WHO/WHAT/WHERE/WHEN accountability schema.",
    "paths": [
      "schemas/accountability/agent-mini-commit-receipt.v0.1.schema.json"
    ]
  },
  "where": {
    "repository": "jsonwisdom/receiptos-base",
    "branch": "scaffold/agent-mini-commit-accountability-v0-1",
    "external_context": [
      "GITHUB"
    ]
  },
  "when": {
    "observed_at": "2026-08-14T14:33:00-05:00",
    "source": "AGENT_RECORDED_TIMESTAMP"
  },
  "hashes": {
    "subject_commit_sha": "90be46f4102b46df90458cc39438b83c6599181b",
    "parent_commit_sha": "62965a2f0abd0732b309832146d4c8331f887a67"
  },
  "overlay": {
    "sources": {
      "github": "MATCH",
      "basescan": "NOT_APPLICABLE",
      "eas": "NOT_APPLICABLE",
      "ens": "NOT_APPLICABLE"
    },
    "agreement": {
      "source_count": 1,
      "match_count": 1,
      "conflict_count": 0
    },
    "state": "OBSERVED"
  },
  "authority_created": false
}
